{
  "stage": "scoring",
  "student_id": "Ulysses",
  "worksheet": "WS11",
  "blocked": false,
  "total_score": 0.0,
  "max_score": 0.0,
  "calibration_note": "Confidence calibrated via confidence_calibration.py (review_threshold=0.7).",
  "items": [
    {
      "item": "WS11_B8a",
      "score": 0.0,
      "confidence": 0.0,
      "review": true
    },
    {
      "item": "WS11_B8b",
      "score": 0.0,
      "confidence": 0.0,
      "review": true
    },
    {
      "item": "WS11_B9",
      "score": 0.0,
      "confidence": 0.0,
      "review": true
    },
    {
      "item": "WS11_Q10_1",
      "score": 0.0,
      "confidence": 0.0,
      "review": true
    },
    {
      "item": "WS11_Q10_2",
      "score": 0.0,
      "confidence": 0.0,
      "review": true
    },
    {
      "item": "WS11_Q10_3",
      "score": 0.0,
      "confidence": 0.0,
      "review": true
    },
    {
      "item": "WS11_Q10_4",
      "score": 0.0,
      "confidence": 0.0,
      "review": true
    },
    {
      "item": "WS11_Q10_5",
      "score": 0.0,
      "confidence": 0.0,
      "review": true
    },
    {
      "item": "WS11_Q10_6",
      "score": 0.0,
      "confidence": 0.0,
      "review": true
    },
    {
      "item": "WS11_Q10_7",
      "score": 0.0,
      "confidence": 0.0,
      "review": true
    },
    {
      "item": "WS11_Q10_8",
      "score": 0.0,
      "confidence": 0.0,
      "review": true
    },
    {
      "item": "WS11_Q11_2",
      "score": 0.0,
      "confidence": 0.0,
      "review": true
    },
    {
      "item": "WS11_Q11_3",
      "score": 0.0,
      "confidence": 0.0,
      "review": true
    },
    {
      "item": "WS11_Q11_4",
      "score": 0.0,
      "confidence": 0.0,
      "review": true
    },
    {
      "item": "WS11_Q12_1",
      "score": 0.0,
      "confidence": 0.0,
      "review": true
    },
    {
      "item": "WS11_Q12_2",
      "score": 0.0,
      "confidence": 0.0,
      "review": true
    },
    {
      "item": "WS11_Q12_3",
      "score": 0.0,
      "confidence": 0.0,
      "review": true
    },
    {
      "item": "WS11_Q12_4",
      "score": 0.0,
      "confidence": 0.0,
      "review": true
    },
    {
      "item": "WS11_Q12_5",
      "score": 0.0,
      "confidence": 0.0,
      "review": true
    }
  ]
}
