{
  "stage": "scoring",
  "student_id": "Serena",
  "worksheet": "WS7",
  "blocked": false,
  "blocked_reason": "WS6 extraction required for B1–B3 rule checks.",
  "total_score": 0.0,
  "max_score": 7.0,
  "items": [
    {
      "item": "WS7_1",
      "score": 0.0,
      "confidence": 0.85,
      "review": false
    },
    {
      "item": "WS7_2",
      "score": 0.0,
      "confidence": 0.85,
      "review": false
    },
    {
      "item": "WS7_3",
      "score": 0.0,
      "confidence": 0.85,
      "review": false
    },
    {
      "item": "WS7_4",
      "score": 0.0,
      "confidence": 0.85,
      "review": false
    },
    {
      "item": "WS7_5",
      "score": 0.0,
      "confidence": 0.85,
      "review": false
    },
    {
      "item": "WS7_6",
      "score": 0.0,
      "confidence": 0.85,
      "review": false
    },
    {
      "item": "WS7_7",
      "score": 0.0,
      "confidence": 0.85,
      "review": false
    }
  ]
}
