{
  "stage": "scoring",
  "student_id": "Isabel",
  "worksheet": "WS10",
  "blocked": false,
  "total_score": 7.0,
  "max_score": 8.0,
  "items": [
    {
      "item": "WS10_B1",
      "score": 1.0,
      "confidence": 1.0,
      "review": false
    },
    {
      "item": "WS10_B2",
      "score": 1.0,
      "confidence": 1.0,
      "review": false
    },
    {
      "item": "WS10_B3",
      "score": 1.0,
      "confidence": 1.0,
      "review": false
    },
    {
      "item": "WS10_B4",
      "score": 1.0,
      "confidence": 1.0,
      "review": false
    },
    {
      "item": "WS10_B5",
      "score": 1.0,
      "confidence": 1.0,
      "review": false
    },
    {
      "item": "WS10_B6",
      "score": 1.0,
      "confidence": 1.0,
      "review": false
    },
    {
      "item": "WS10_B7",
      "score": 1.0,
      "confidence": 1.0,
      "review": false
    },
    {
      "item": "WS10_B8",
      "score": 0.0,
      "confidence": 0.35,
      "review": true
    }
  ]
}
