{
  "stage": "scoring",
  "student_id": "Amy",
  "worksheet": "WS3",
  "blocked": false,
  "total_score": 0.0,
  "max_score": 8.0,
  "note": "LLM-scored via worksheet_assessor.assess_worksheet (model=claude-sonnet-5); 8 item(s) flagged for review.",
  "calibration_note": "Confidence calibrated via confidence_calibration.py (review_threshold=0.7).",
  "items": [
    {
      "item": "WS3_B1",
      "score": 0.0,
      "confidence": 0.0,
      "review": true
    },
    {
      "item": "WS3_B2",
      "score": 0.0,
      "confidence": 0.0,
      "review": true
    },
    {
      "item": "WS3_B3",
      "score": 0.0,
      "confidence": 0.0,
      "review": true
    },
    {
      "item": "WS3_B4",
      "score": 0.0,
      "confidence": 0.0,
      "review": true
    },
    {
      "item": "WS3_B5",
      "score": 0.0,
      "confidence": 0.0,
      "review": true
    },
    {
      "item": "WS3_B6",
      "score": 0.0,
      "confidence": 0.0,
      "review": true
    },
    {
      "item": "WS3_B7",
      "score": 0.0,
      "confidence": 0.0,
      "review": true
    },
    {
      "item": "WS3_B8",
      "score": 0.0,
      "confidence": 0.0,
      "review": true
    }
  ]
}
